Region, Division, Township
Magway Region, Gangaw, Gangaw
Magway Region, Gangaw, Kyaukhtu
Magway Region, Gangaw, Saw
Magway Region, Gangaw, Tilin
Magway Region, Magway, Chauck
Magway Region, Magway, Magway
Magway Region, Magway, Myothit
Magway Region, Magway, Natmauk
Magway Region, Magway, Taungdwingyi
Magway Region, Magway, Yenangyaung
Magway Region, Minbu, Minbu
Magway Region, Minbu, Ngape
Magway Region, Minbu, Pwintbyu
Magway Region, Minbu, Salin
Magway Region, Minbu, Sidoktaya
Magway Region, Pakokku, Myaing
Magway Region, Pakokku, Pakokku
Magway Region, Pakokku, Pauk
Magway Region, Pakokku, Seikphyu
Magway Region, Pakokku, Yesagyo
Magway Region, Thayet, Aunglan
Magway Region, Thayet, Kamma
Magway Region, Thayet, Mindon
Magway Region, Thayet, Minhla
Magway Region, Thayet, Sinbaungwe
Magway Region, Thayet, Thayet
Mandalay Region, Kyaukse, Kyaukse
Mandalay Region, Kyaukse, Myittha
Mandalay Region, Kyaukse, Sintgaing
Mandalay Region, Kyaukse, Tada-U
Mandalay Region, Mandalay, Amarapura
Mandalay Region, Mandalay, Aungmyethazan
Mandalay Region, Mandalay, Chanayethazan
Mandalay Region, Mandalay, Chanmyathazi
Mandalay Region, Mandalay, Mahaaungmye
Mandalay Region, Mandalay, Patheingyi
Mandalay Region, Mandalay, Pyigyidagun
Mandalay Region, Meiktila, Mahlaing
Mandalay Region, Meiktila, Meiktila
Mandalay Region, Meiktila, Thazi
Mandalay Region, Meiktila, Wundwin
Mandalay Region, Myingyan, Myingyan
Mandalay Region, Myingyan, Natogyi
Mandalay Region, Myingyan, Nganzun
Mandalay Region, Myingyan, Thaungtha
Mandalay Region, Nyaung-U, Kyaukpadaung
Mandalay Region, Nyaung-U, Ngathayauk
Mandalay Region, Nyaung-U, Nyaung-U
Mandalay Region, Pyinoolwin, Madaya
Mandalay Region, Pyinoolwin, Mogok
Mandalay Region, Pyinoolwin, Pyinoolwin
Mandalay Region, Pyinoolwin, Singu
Mandalay Region, Pyinoolwin, Tagaung
Mandalay Region, Pyinoolwin, Thabeikkyin
Mandalay Region, Yamethin, Pyawbwe
Mandalay Region, Yamethin, Yamethin
Naypyidaw Union Territory, Dekkhina(South Naypyidaw), Dekkhinathiri
Naypyidaw Union Territory, Dekkhina(South Naypyidaw), Lewe
Naypyidaw Union Territory, Dekkhina(South Naypyidaw), Pyinmana
Naypyidaw Union Territory, Dekkhina(South Naypyidaw), Zabuthiri
Naypyidaw Union Territory, Ottara(North Naypyidaw), Ottarathiri
Naypyidaw Union Territory, Ottara(North Naypyidaw), Pobbathiri
Naypyidaw Union Territory, Ottara(North Naypyidaw), Tatkon
Naypyidaw Union Territory, Ottara(North Naypyidaw), Zeyarthiri
Kayah State, Bawlakhe, Bawlakhe
Kayah State, Bawlakhe, Hpasawng
Kayah State, Bawlakhe, Mese
Kayah State, Bawlakhe, Ywathit
Kayah State, Loikaw, Demoso
Kayah State, Loikaw, Hpruso
Kayah State, Loikaw, Loikaw
Kayah State, Loikaw, Shadaw
Shan State, Kengtung, Kengtung
Shan State, Kengtung, Mine Pauk
Shan State, Kengtung, Minelar
Shan State, Kengtung, Mong Khet
Shan State, Kengtung, Mong La
Shan State, Kengtung, Mong Yang
Shan State, Mong Hpayak, Mineyu
Shan State, Mong Hpayak, Mong Hpayak
Shan State, Mong Hpayak, Mong Yawng
Shan State, Mong Hsat, Minekoke
Shan State, Mong Hsat, Monehta
Shan State, Mong Hsat, Mong Hsat
Shan State, Mong Hsat, Mong Ping
Shan State, Mong Hsat, Mong Tong
Shan State, Mong Hsat, Ponparkyin
Shan State, Mong Hsat, Tontar
Shan State, Tachileik, Kyaing Lap
Shan State, Tachileik, Tachileik
Shan State, Tachileik, Talay
Shan State, Kunlong, Kunlong
Shan State, Kyaukme, Hsipaw
Shan State, Kyaukme, Kyaukme
Shan State, Kyaukme, Mantong
Shan State, Kyaukme, Minelon
Shan State, Kyaukme, Minengaw
Shan State, Kyaukme, Namhsan
Shan State, Kyaukme, Namtu
Shan State, Kyaukme, Nawnghkio
Shan State, Lashio, Hsenwi
Shan State, Lashio, Lashio
Shan State, Lashio, Mongyai
Shan State, Lashio, Tangyan
Shan State, Laukkaing, Chinshwehaw
Shan State, Laukkaing, Konkyan
Shan State, Laukkaing, Laukkaing
Shan State, Laukkaing, Mawhtike
Shan State, Mu Se, Kutkai
Shan State, Mu Se, Manhero
Shan State, Mu Se, Monekoe
Shan State, Mu Se, Mu Se
Shan State, Mu Se, Namhkam
Shan State, Mu Se, Pansai
Shan State, Mu Se, Tamoenye
Shan State, Hopang, Hopang
Shan State, Hopang, Mongmao
Shan State, Hopang, Namtit
Shan State, Hopang, Pangwaun
Shan State, Hopang, Panlong
Shan State, Matman, Man Kan
Shan State, Matman, Matman
Shan State, Matman, Namphan
Shan State, Matman, Pangsang Township (Pan
Shan State, Mongmit, Mabein
Shan State, Mongmit, Mongmit
Shan State, Langkho, Homane
Shan State, Langkho, Kengtaung
Shan State, Langkho, Langkho
Shan State, Langkho, Mawkmai
Shan State, Langkho, Mong Nai
Shan State, Langkho, Mong Pan
Shan State, Loilen, Karli
Shan State, Loilen, Kholan
Shan State, Loilen, Kunhing
Shan State, Loilen, Kyethi
Shan State, Loilen, Lai-Hka
Shan State, Loilen, Loilen
Shan State, Loilen, Minenaung
Shan State, Loilen, Minesan
Shan State, Loilen, Mong Hsu
Shan State, Loilen, Mong Kung
Shan State, Loilen, Nansang
Shan State, Loilen, Panglong
Shan State, Taunggyi, Hopong
Shan State, Taunggyi, Hsi Hseng
Shan State, Taunggyi, Indaw
Shan State, Taunggyi, Kalaw
Shan State, Taunggyi, Kyauktalongyi
Shan State, Taunggyi, Lawksawk
Shan State, Taunggyi, Naungtayar
Shan State, Taunggyi, Nyaungshwe
Shan State, Taunggyi, Pekon
Shan State, Taunggyi, Pingdaya
Shan State, Taunggyi, Pinlaung
Shan State, Taunggyi, Taunggyi
Shan State, Taunggyi, Ywangan
Ayeyarwady Region, Hinthada, Hinthada
Ayeyarwady Region, Hinthada, Ingapu
Ayeyarwady Region, Hinthada, Kyangin
Ayeyarwady Region, Hinthada, Lemyethna
Ayeyarwady Region, Hinthada, Myanaung
Ayeyarwady Region, Hinthada, Zalun
Ayeyarwady Region, Labutta, Labutta
Ayeyarwady Region, Labutta, Mawlamyinegyun
Ayeyarwady Region, Labutta, Pyinsalu
Ayeyarwady Region, Ma-ubin, Danuphyu
Ayeyarwady Region, Ma-ubin, Ma-ubin
Ayeyarwady Region, Ma-ubin, Nyaungdon
Ayeyarwady Region, Ma-ubin, Pantanaw
Ayeyarwady Region, Myaungmya, Einme
Ayeyarwady Region, Myaungmya, Myaungmya
Ayeyarwady Region, Myaungmya, Wakema
Ayeyarwady Region, Pathein, Hainggyikyun
Ayeyarwady Region, Pathein, Kangyidaunk
Ayeyarwady Region, Pathein, Kyaunggon
Ayeyarwady Region, Pathein, Kyonpyaw
Ayeyarwady Region, Pathein, Ngapudaw
Ayeyarwady Region, Pathein, Ngathaingchaung
Ayeyarwady Region, Pathein, Ngayokaung
Ayeyarwady Region, Pathein, Ngwehsaung
Ayeyarwady Region, Pathein, Pathein
Ayeyarwady Region, Pathein, Shwethaungyan
Ayeyarwady Region, Pathein, Thabaung
Ayeyarwady Region, Pathein, Yekyi
Ayeyarwady Region, Pyapon, Ahmar
Ayeyarwady Region, Pyapon, Bogale
Ayeyarwady Region, Pyapon, Dedaye
Ayeyarwady Region, Pyapon, Kyaiklat
Ayeyarwady Region, Pyapon, Pyapon
Bago Region, Bago, Aungmyin
Bago Region, Bago, Bago
Bago Region, Bago, Daik-U
Bago Region, Bago, Hpayargyi
Bago Region, Bago, Intagaw
Bago Region, Bago, Kawa
Bago Region, Bago, Kyauktaga
Bago Region, Bago, Madauk
Bago Region, Bago, Nyaunglebin
Bago Region, Bago, Peinzalot
Bago Region, Bago, Penwegon
Bago Region, Bago, Pyuntaza
Bago Region, Bago, Shwegyin
Bago Region, Bago, Thanatpin
Bago Region, Bago, Waw
Bago Region, Taungoo, Kanyutkwin
Bago Region, Taungoo, Kaytumadi
Bago Region, Taungoo, Kyaukkyi
Bago Region, Taungoo, Kywebwe
Bago Region, Taungoo, Mone
Bago Region, Taungoo, Myohla
Bago Region, Taungoo, Natthangwin
Bago Region, Taungoo, Nyaungbinthar
Bago Region, Taungoo, Oktwin
Bago Region, Taungoo, Pyu
Bago Region, Taungoo, Swa
Bago Region, Taungoo, Tantabin
Bago Region, Taungoo, Taungoo
Bago Region, Taungoo, Thagara
Bago Region, Taungoo, Yaeni
Bago Region, Taungoo, Yedashe
Bago Region, Pyay, Innma
Bago Region, Pyay, Okshipin
Bago Region, Pyay, Padaung
Bago Region, Pyay, Padigone
Bago Region, Pyay, Paukkaung
Bago Region, Pyay, Paungdale
Bago Region, Pyay, Paungde
Bago Region, Pyay, Pyay
Bago Region, Pyay, Shwedaung
Bago Region, Pyay, Sinmeswe
Bago Region, Pyay, Thegon
Bago Region, Thayarwady, Gyobingauk
Bago Region, Thayarwady, Letpadan
Bago Region, Thayarwady, Minhla
Bago Region, Thayarwady, Monyo
Bago Region, Thayarwady, Nattalin
Bago Region, Thayarwady, Okpho
Bago Region, Thayarwady, Ooethegone
Bago Region, Thayarwady, Sitkwin
Bago Region, Thayarwady, Tapun
Bago Region, Thayarwady, Tharrawaddy
Bago Region, Thayarwady, Thonze
Bago Region, Thayarwady, Zigon
Yangon Region, East Yangon, Botataung
Yangon Region, East Yangon, City
Yangon Region, East Yangon, Dagon Seikkan
Yangon Region, East Yangon, Dawbon
Yangon Region, East Yangon, East Dagon
Yangon Region, East Yangon, Mingala Taungnyunt
Yangon Region, East Yangon, North Dagon
Yangon Region, East Yangon, North Okkalapa
Yangon Region, East Yangon, Pazundaung
Yangon Region, East Yangon, South Dagon
Yangon Region, East Yangon, South Okkalapa
Yangon Region, East Yangon, Tamwe
Yangon Region, East Yangon, Thaketa
Yangon Region, East Yangon, Thingangyun
Yangon Region, East Yangon, Yankin
Yangon Region, North Yangon, City
Yangon Region, North Yangon, Hlaingthaya
Yangon Region, North Yangon, Hlegu
Yangon Region, North Yangon, Hmawbi
Yangon Region, North Yangon, Htantabin
Yangon Region, North Yangon, Insein
Yangon Region, North Yangon, Mingaladon
Yangon Region, North Yangon, Rural
Yangon Region, North Yangon, Shwepyitha
Yangon Region, North Yangon, Taikkyi
Yangon Region, South Yangon, City
Yangon Region, South Yangon, Cocokyun
Yangon Region, South Yangon, Dala
Yangon Region, South Yangon, Kawhmu
Yangon Region, South Yangon, Kayan
Yangon Region, South Yangon, Kungyangon
Yangon Region, South Yangon, Kyauktan
Yangon Region, South Yangon, Rural
Yangon Region, South Yangon, Seikkyi Kanaungto
Yangon Region, South Yangon, Tada
Yangon Region, South Yangon, Thanlyin
Yangon Region, South Yangon, Thongwa
Yangon Region, South Yangon, Twante
Yangon Region, West Yangon(Downtown), Ahlon
Yangon Region, West Yangon(Downtown), Bahan
Yangon Region, West Yangon(Downtown), City
Yangon Region, West Yangon(Downtown), Dagon
Yangon Region, West Yangon(Downtown), Hlaing
Yangon Region, West Yangon(Downtown), Kamayut
Yangon Region, West Yangon(Downtown), Kyauktada
Yangon Region, West Yangon(Downtown), Kyimyindaing
Yangon Region, West Yangon(Downtown), Lanmadaw
Yangon Region, West Yangon(Downtown), Latha
Yangon Region, West Yangon(Downtown), Mayangon
Yangon Region, West Yangon(Downtown), Pabedan
Yangon Region, West Yangon(Downtown), Sanchaung
Yangon Region, West Yangon(Downtown), Seikkan
Kachin State, Bhamo, Bhamo
Kachin State, Bhamo, Dotphoneyan
Kachin State, Bhamo, Lwegel
Kachin State, Bhamo, Mansi
Kachin State, Bhamo, Momauk
Kachin State, Bhamo, Myohla
Kachin State, Bhamo, Shwegu
Kachin State, Mohnyin, Hopin
Kachin State, Mohnyin, Hpakant
Kachin State, Mohnyin, Kamine
Kachin State, Mohnyin, Mogaung
Kachin State, Mohnyin, Mohnyin
Kachin State, Myitkyina, Chipwi
Kachin State, Myitkyina, Hsadone
Kachin State, Myitkyina, Hsawlaw
Kachin State, Myitkyina, Hsinbo
Kachin State, Myitkyina, Injangyang
Kachin State, Myitkyina, Kanpaikti
Kachin State, Myitkyina, Myitkyina
Kachin State, Myitkyina, Panwa
Kachin State, Myitkyina, Shinbwayyan
Kachin State, Myitkyina, Tanai
Kachin State, Myitkyina, Waingmaw
Kachin State, Putao, Kawnglanghpu
Kachin State, Putao, Machanbaw
Kachin State, Putao, Nogmung
Kachin State, Putao, Pannandin
Kachin State, Putao, Putao
Kachin State, Putao, Sumprabum
Sagaing Region, Hkamti, Donhee
Sagaing Region, Hkamti, Hkamti
Sagaing Region, Hkamti, Homalin
Sagaing Region, Hkamti, Htanparkway
Sagaing Region, Hkamti, Lahe
Sagaing Region, Hkamti, Leshi Township (Lay
Sagaing Region, Hkamti, Mobaingluk
Sagaing Region, Hkamti, Nanyun
Sagaing Region, Hkamti, Pansaung
Sagaing Region, Hkamti, Sonemara
Sagaing Region, Kanbalu, Kanbalu
Sagaing Region, Kanbalu, Kyunhla
Sagaing Region, Kanbalu, Taze
Sagaing Region, Kanbalu, Ye-U
Sagaing Region, Kale, Kale
Sagaing Region, Kale, Kalewa
Sagaing Region, Kale, Mingin
Sagaing Region, Katha, Banmauk
Sagaing Region, Katha, Indaw
Sagaing Region, Katha, Katha
Sagaing Region, Katha, Kawlin
Sagaing Region, Katha, Pinlebu
Sagaing Region, Katha, Tigyaing
Sagaing Region, Katha, Wuntho
Sagaing Region, Mawlaik, Mawlaik
Sagaing Region, Mawlaik, Paungbyin
Sagaing Region, Monywa, Ayadaw
Sagaing Region, Monywa, Budalin
Sagaing Region, Monywa, Chaung-U
Sagaing Region, Monywa, Monywa
Sagaing Region, Sagaing, Myaung
Sagaing Region, Sagaing, Myinmu
Sagaing Region, Sagaing, Sagaing
Sagaing Region, Shwebo, Khin-U
Sagaing Region, Shwebo, Kyaukmyaung
Sagaing Region, Shwebo, Shwebo
Sagaing Region, Shwebo, Tabayin
Sagaing Region, Shwebo, Wetlet
Sagaing Region, Tamu, Khampat
Sagaing Region, Tamu, Myothit
Sagaing Region, Tamu, Tamu
Sagaing Region, Yinmabin, Kani
Sagaing Region, Yinmabin, Pale
Sagaing Region, Yinmabin, Salingyi
Sagaing Region, Yinmabin, Yinmabin
Kayin State, Hpa-an, Bawgali
Kayin State, Hpa-an, Hlaignbwe
Kayin State, Hpa-an, Hpa-an
Kayin State, Hpa-an, Leiktho
Kayin State, Hpa-an, Paingkyon
Kayin State, Hpa-an, Shan Ywathit
Kayin State, Hpa-an, Thandaunggyi
Kayin State, Hpapun, Hpapun
Kayin State, Hpapun, Kamamaung
Kayin State, Kawkareik, Kawkareik
Kayin State, Kawkareik, Kyaidon
Kayin State, Kawkareik, Kyain Seikgyi
Kayin State, Kawkareik, Payarthonezu
Kayin State, Myawaddy, Myawaddy
Kayin State, Myawaddy, Sugali
Kayin State, Myawaddy, Wawlaymyaing
Mon State, Mawlamyine, Chaungzon
Mon State, Mawlamyine, Khawzar
Mon State, Mawlamyine, Kyaikkhami
Mon State, Mawlamyine, Kyaikmaraw
Mon State, Mawlamyine, Lamine
Mon State, Mawlamyine, Mawlamyine
Mon State, Mawlamyine, Mudon
Mon State, Mawlamyine, Thanbyuzayat
Mon State, Mawlamyine, Ye
Mon State, Thaton, Bilin
Mon State, Thaton, Kyaikto
Mon State, Thaton, Mottama
Mon State, Thaton, Paung
Mon State, Thaton, Suvannawadi
Mon State, Thaton, Thaton
Mon State, Thaton, Zingyeik
Tanintharyi Region, Dawei, Dawei
Tanintharyi Region, Dawei, Kaleinaung
Tanintharyi Region, Dawei, Launglon
Tanintharyi Region, Dawei, Myitta
Tanintharyi Region, Dawei, Thayetchaung
Tanintharyi Region, Dawei, Yebyu
Tanintharyi Region, Kawthoung, Bokpyin
Tanintharyi Region, Kawthoung, Karathuri
Tanintharyi Region, Kawthoung, Kawthoung
Tanintharyi Region, Kawthoung, Khamaukgyi
Tanintharyi Region, Kawthoung, Pyigyimandaing
Tanintharyi Region, Myeik, Kyunsu
Tanintharyi Region, Myeik, Myeik
Tanintharyi Region, Myeik, Palauk
Tanintharyi Region, Myeik, Palaw
Tanintharyi Region, Myeik, Tanintharyi
Chin State, Falam, Cikha
Chin State, Falam, Falam
Chin State, Falam, Rikhuadal
Chin State, Falam, Tiddim
Chin State, Falam, Ton Zang
Chin State, Hakha, Hakha
Chin State, Hakha, Htantlang
Chin State, Mindat, Kanpetlet
Chin State, Mindat, Matupi
Chin State, Mindat, Mindat
Chin State, Mindat, Paletwa
Chin State, Mindat, Reazu
Chin State, Mindat, Sami
Rakhine State, Kyaukpyu, Ann
Rakhine State, Kyaukpyu, Kyaukpyu
Rakhine State, Kyaukpyu, Manaung
Rakhine State, Kyaukpyu, Ramree
Rakhine State, Maungdaw, Buthidaung
Rakhine State, Maungdaw, Maungdaw
Rakhine State, Maungdaw, Taungpyoletwe
Rakhine State, Sittwe, Pauktaw
Rakhine State, Sittwe, Ponnagyun
Rakhine State, Sittwe, Rathedaung
Rakhine State, Sittwe, Sittwe
Rakhine State, Thandwe, Gaw
Rakhine State, Thandwe, Kyeintali
Rakhine State, Thandwe, Maei
Rakhine State, Thandwe, Thandwe
Rakhine State, Thandwe, Toungup
Rakhine State, Mrauk-U, Kyauktaw
Rakhine State, Mrauk-U, Minbya
Rakhine State, Mrauk-U, Mrauk-U
Rakhine State, Mrauk-U, Myebon